{
 "lectura": [
  {
   "text": "Bitcoin apenas se mueve, pero bajo la superficie cambian dos cosas: los ETF encadenan {{fa:etf_flow_streak_days}} sesiones seguidas de salidas y el interés abierto sube un {{fa:oi_chg_24h_pct}} sin que el precio acompañe.",
   "kind": "hecho",
   "fact_ids": [
    "etf_net_flow_usd_1d",
    "etf_flow_streak_days",
    "oi_chg_24h_pct"
   ],
   "hint_ids": []
  },
  {
   "text": "Es una combinación que suele reflejar más posicionamiento apalancado que demanda de contado, y que aumenta la sensibilidad a movimientos bruscos en el corto plazo.",
   "kind": "interpretacion",
   "fact_ids": [
    "oi_chg_24h_pct",
    "etf_net_flow_usd_1d"
   ],
   "hint_ids": []
  },
  {
   "text": "El fondo no ha cambiado: la liquidez global sigue en expansión y el sentimiento se ha normalizado tras salir de la zona de codicia.",
   "kind": "matiz",
   "fact_ids": [
    "liquidity_regime",
    "fng_value"
   ],
   "hint_ids": [
    "fng_value:h.fng_regime_change"
   ]
  }
 ],
 "vigilar": {
  "watch_id": "metric:etf_streak",
  "text": "Si los ETF vuelven a registrar salidas: con el apalancamiento al alza, la demanda de contado es hoy la variable que más pesa.",
  "fact_ids": [
   "etf_net_flow_usd_1d",
   "etf_flow_streak_days",
   "oi_chg_24h_pct"
  ]
 },
 "block_comments": [
  {
   "block": "sentimiento",
   "text": "El índice pasa {{h:fng_value:h.fng_path}}: el mercado se enfría sin llegar al miedo.",
   "fact_ids": [
    "fng_value",
    "fng_value_7d_ago"
   ],
   "hint_ids": [
    "fng_value:h.fng_path"
   ]
  },
  {
   "block": "demanda_etf",
   "text": "Indicador de demanda a través de productos regulados, no de compras o ventas institucionales.",
   "fact_ids": [
    "etf_net_flow_usd_1d"
   ],
   "hint_ids": []
  },
  {
   "block": "derivados",
   "text": "El apalancamiento crece sin movimiento de precio.",
   "fact_ids": [
    "oi_chg_24h_pct"
   ],
   "hint_ids": [
    "oi_chg_24h_pct:h.lev_without_price"
   ]
  }
 ],
 "watch_override_reason": null
}